{
  "$schema": "../../schemas/evidence_review_prompt_experiment_manifest_v1.schema.json",
  "baseline_reference": {
    "manifest_sha256": "ce320dfb6c0b910c445ef55bd9353bb78c13d2693f6078c92eae72e3edf5b9f6",
    "runtime_run_id": "mit60001_evidence_reviewer_0ee5e6a1362fc5c4"
  },
  "comparison": {
    "decision_change_count": 6,
    "question_count": 40,
    "same_top3_count": 40,
    "supporting_id_change_count": 23
  },
  "execution_config": {
    "api_mode": "ollama_api_chat",
    "contract_version": "retrieval_evidence_review_contract_v2",
    "endpoint": "http://127.0.0.1:11434",
    "num_predict": 512,
    "seed": 42,
    "structured_output_schema_version": "evidence_review_response_v1",
    "temperature": 0.0
  },
  "experiment_run_id": "mit60001_evidence_prompt_experiment_256f435e9d3e0bfd",
  "experiment_scope": "provider_independent_prompt_comparison_without_ground_truth",
  "input_sha256": {
    "baseline_manifest": "ce320dfb6c0b910c445ef55bd9353bb78c13d2693f6078c92eae72e3edf5b9f6",
    "contract": "8a55dc8a37e1c37ec3b4a070c8d6feac4be80fc542bd9a6e80e3613f9c29de97",
    "contracts_module": "aab63806d4a8f774b2a551b6b3431dc940236851a931b5d9cd047d5eb38c2ee5",
    "experiment_manifest_schema": "bb0658b6def8d3373422069bce06d593f8ccb4be579b4b64eb3e207724b8dd57",
    "ollama_adapter": "dace17dee2e82ad8a738570ec6310d7051f38dd303bc2c71bf6e0d9979721a85",
    "prompt_v1_module": "c8aea644bf3d6b41c8bdfd5f3f0918794be58700de065d892a1b96e5082e5f6a",
    "prompt_v2_module": "0b50fc4759434808bd4bdf4b9428feae92141f6a8a0fcb20673d5b6c45901fa1",
    "request_package": "1cafc735ec5a40cf0179c017f064dd9cd3d187f0a4b90564d68680928e257a3e",
    "request_schema": "23097956afea34171350b8ea1897f6c347ace1c2adafd0fe7de78ea4fc1a0da3",
    "response_schema": "ce7dd6aafe3667f9fbc33b097d1a6747c2eb165a7bc02034da23a1336a0133cf",
    "runtime_script": "96f5b3e17f2138360fb8591914b0d455478017405beac134079fc0f079b7b5e2"
  },
  "runtime": {
    "digest": "a80c4f17acd55265feec403c7aef86be0c25983ab279d83f3bcd3abbcb5b8b72",
    "family": "llama",
    "model": "llama3.2:3b",
    "ollama_version": "0.32.14",
    "parameter_size": "3.2B",
    "quantization_level": "Q4_K_M",
    "size_bytes": 2019393189
  },
  "schema_version": "evidence_review_prompt_experiment_manifest_v1",
  "validation_status": "passed",
  "variants": [
    {
      "accept_count": 26,
      "failure_count": 0,
      "output_artifacts": [
        {
          "file": "evaluation/review/evidence_accept_reject/experiments/prompt_v2/control_v1_reviews.jsonl",
          "sha256": "14895adb11013a0144705bae19410645fd981711169578f16fbb6a824aed00e2"
        },
        {
          "file": "reports/16_evidence_reviewer_prompt_experiment/control_v1_validation.csv",
          "sha256": "e00bf7d4e85e5d8d54456547a7bb4902f3699a721877f60ea5816c6d77c1c4a6"
        }
      ],
      "prompt_version": "evidence_review_prompt_v1",
      "question_count": 40,
      "reject_count": 14,
      "runtime_run_id": "mit60001_evidence_reviewer_experiment_ca0dce45e380deb4",
      "system_prompt_sha256": "6926d2ac5069f8c5ed2ebd3620f3a4a865aa678f62c3d885dbbef030d8ec5cf2",
      "variant_id": "control_v1"
    },
    {
      "accept_count": 30,
      "failure_count": 0,
      "output_artifacts": [
        {
          "file": "evaluation/review/evidence_accept_reject/experiments/prompt_v2/candidate_v2_reviews.jsonl",
          "sha256": "e39d9fe964e4f2d516fb30de93d7e3290c080bbc0d3fee65bfdf25e23464b06a"
        },
        {
          "file": "reports/16_evidence_reviewer_prompt_experiment/candidate_v2_validation.csv",
          "sha256": "c47dc29eb6f00e1211214e8cde8d3a71294715581a324d1bde8327a4a2ca7c3e"
        }
      ],
      "prompt_version": "evidence_review_prompt_v2_complete_coverage",
      "question_count": 40,
      "reject_count": 10,
      "runtime_run_id": "mit60001_evidence_reviewer_experiment_6b40770f0932351a",
      "system_prompt_sha256": "09b0c2e5b1177d112bb266ffb067f726b2e04ad3bbe761c019338b8b2ab2434a",
      "variant_id": "candidate_v2"
    }
  ]
}
